{
  "$schema": "http://json-schema.org/draft-07/schema#",
  "title": "eniGOma Configuration Schema v1",
  "description": "Schema for eniGOma Enigma machine configuration files",
  "type": "object",
  "required": [
    "schema_version",
    "alphabet",
    "rotor_specs",
    "reflector_spec"
  ],
  "properties": {
    "schema_version": {
      "type": "integer",
      "description": "Version of the configuration schema",
      "enum": [1]
    },
    "alphabet": {
      "type": "string",
      "description": "The character set used by this Enigma machine",
      "minLength": 2
    },
    "rotor_specs": {
      "type": "array",
      "description": "Specifications for rotors in the machine",
      "minItems": 1,
      "items": {
        "type": "object",
        "required": [
          "id",
          "forward_mapping",
          "notches",
          "position",
          "ring_setting"
        ],
        "properties": {
          "id": {
            "type": "string",
            "description": "Unique identifier for the rotor",
            "minLength": 1
          },
          "forward_mapping": {
            "type": "string",
            "description": "Character mapping for the rotor in forward direction"
          },
          "notches": {
            "type": "array",
            "description": "Characters that trigger the next rotor to step",
            "items": {
              "type": "string",
              "minLength": 1,
              "maxLength": 1
            }
          },
          "position": {
            "type": "integer",
            "description": "Current position of the rotor",
            "minimum": 0
          },
          "ring_setting": {
            "type": "integer",
            "description": "Ring setting of the rotor",
            "minimum": 0
          }
        }
      }
    },
    "reflector_spec": {
      "type": "object",
      "description": "Specification for the reflector",
      "required": [
        "id",
        "mapping"
      ],
      "properties": {
        "id": {
          "type": "string",
          "description": "Identifier for the reflector",
          "minLength": 1
        },
        "mapping": {
          "type": "object",
          "description": "Character mapping for the reflector",
          "additionalProperties": {
            "type": "string",
            "minLength": 1,
            "maxLength": 1
          }
        }
      }
    },
    "plugboard_pairs": {
      "type": "object",
      "description": "Plugboard character pairings",
      "additionalProperties": {
        "type": "string",
        "minLength": 1,
        "maxLength": 1
      }
    },
    "current_rotor_positions": {
      "type": "array",
      "description": "Current positions of rotors (overrides positions in rotor_specs)",
      "items": {
        "type": "integer",
        "minimum": 0
      }
    },
    "metadata": {
      "type": "object",
      "description": "Optional metadata about this configuration",
      "properties": {
        "created_at": {
          "type": "string",
          "format": "date-time",
          "description": "When this configuration was created"
        },
        "created_by": {
          "type": "string",
          "description": "Who or what created this configuration"
        },
        "description": {
          "type": "string",
          "description": "Human-readable description of this configuration"
        },
        "preset": {
          "type": "string",
          "description": "Preset this configuration was based on"
        },
        "tags": {
          "type": "array",
          "description": "Tags for categorizing this configuration",
          "items": {
            "type": "string"
          }
        }
      }
    }
  }
}
